{
  "specVersion": "0.1.0",
  "id": "contract-fixture",
  "version": "0.1.0",
  "sdk": {
    "range": "^0.1.0"
  },
  "title": "Contract fixture (not playable)",
  "entry": "index.html",
  "artifacts": [
    {
      "path": "index.html",
      "sha256": "5594c66147708301ab2c9a47e0a184ec3276af4ab524525fa1b235264de59a93"
    }
  ],
  "provenance": {
    "source": {
      "url": "https://example.com/contract-fixture",
      "revision": "0000000000000000000000000000000000000000",
      "license": "MIT",
      "rightsStatus": "documented"
    },
    "assets": [
      {
        "path": "index.html",
        "kind": "original",
        "license": "MIT",
        "evidence": [
          "https://example.com/contract-fixture"
        ]
      }
    ]
  },
  "input": {
    "controller": true,
    "touch": true
  },
  "runtime": {
    "graphics": {
      "preferred": "webgl2",
      "fallback": null
    },
    "requiredFeatures": [],
    "optionalFeatures": []
  },
  "capabilities": [
    "save.local"
  ],
  "saves": {
    "schemaVersion": 1,
    "guestLocal": true,
    "accountSync": "disabled"
  }
}
